Item Title,Publication Title,Book Series Title,Journal Volume,Journal Issue,Item DOI,Authors,Publication Year,URL,Content Type
Modeling core-scale permeability anisotropy in highly bioturbated “tight oil” reservoir rocks,Computational Geosciences,,,,10.1007/s10596-017-9635-2,Nisael A. SolanoMohammad SoroushChris R. ClarksonFederico F. KrauseJerry L. Jensen,2017,https://link.springer.com/article/10.1007/s10596-017-9635-2,Article
A new method for the construction and optimization of quadrangular adaptive well pattern,Computational Geosciences,,,,10.1007/s10596-017-9626-3,Kai ZhangHao ZhangLiming ZhangPing LiXiaoming ZhangJun Yao,2017,https://link.springer.com/article/10.1007/s10596-017-9626-3,Article
Gradient-based production optimization with simulation-based economic constraints,Computational Geosciences,,,,10.1007/s10596-017-9634-3,Oleg VolkovMathias C. Bellout,2017,https://link.springer.com/article/10.1007/s10596-017-9634-3,Article
An analysis of physical models and numerical schemes for polymer flooding simulations,Computational Geosciences,,,,10.1007/s10596-017-9637-0,Benjamin BraconnierChristophe PreuxÉric FlauraudQuang-Huy TranChristophe Berthon,2017,https://link.springer.com/article/10.1007/s10596-017-9637-0,Article
Fully implicit simulation of polymer flooding with MRST,Computational Geosciences,,,,10.1007/s10596-017-9624-5,Kai BaoKnut-Andreas LieOlav MøynerMing Liu,2017,https://link.springer.com/article/10.1007/s10596-017-9624-5,Article
Successful application of multiscale methods in a real reservoir simulator environment,Computational Geosciences,,,,10.1007/s10596-017-9627-2,K.-A. LieO. MøynerJ. R. NatvigA. KozlovaK. BratvedtS. WatanabeZ. Li,2017,https://link.springer.com/article/10.1007/s10596-017-9627-2,Article
History matching of dual continuum reservoirs—preserving consistency with the fracture model,Computational Geosciences,,,,10.1007/s10596-017-9632-5,Pål Næverlid SævikMartha LienInga Berre,2017,https://link.springer.com/article/10.1007/s10596-017-9632-5,Article
Pore to pore validation of pore network modelling against micromodel experiment results,Computational Geosciences,,,,10.1007/s10596-017-9630-7,Jianhui YangIgor BondinoMohamed RegaiegArthur Moncorgé,2017,https://link.springer.com/article/10.1007/s10596-017-9630-7,Article
Multiple shooting applied to robust reservoir control optimization including output constraints on coherent risk measures,Computational Geosciences,,,,10.1007/s10596-017-9625-4,Andrés CodasKristian G. HanssenBjarne FossAndrea CapoleiJohn Bagterp Jørgensen,2017,https://link.springer.com/article/10.1007/s10596-017-9625-4,Article
Bayesian model selection for complex geological structures using polynomial chaos proxy,Computational Geosciences,,,,10.1007/s10596-017-9629-0,Hamid BazarganMike Christie,2017,https://link.springer.com/article/10.1007/s10596-017-9629-0,Article
Downscaling the 2D Bénard convection equations using continuous data assimilation,Computational Geosciences,,,,10.1007/s10596-017-9619-2,M. U. AltafE. S. TitiT. GebraelO. M. KnioL. ZhaoM. F. McCabeI. Hoteit,2017,https://link.springer.com/article/10.1007/s10596-017-9619-2,Article
A multiresolution ensemble Kalman filter using the wavelet decomposition,Computational Geosciences,,,,10.1007/s10596-017-9622-7,Kyle S. HickmannHumberto C. Godinez,2017,https://link.springer.com/article/10.1007/s10596-017-9622-7,Article
Robustness of statistical algorithms for location of microseismic sources based on surface array data,Computational Geosciences,,,,10.1007/s10596-017-9623-6,A. KushnirA. Varypaev,2017,https://link.springer.com/article/10.1007/s10596-017-9623-6,Article
Smart Interpretation – automatic geological interpretations based on supervised statistical models,Computational Geosciences,,,,10.1007/s10596-017-9621-8,Mats Lundh GulbrandsenKnud Skou CorduaTorben BachThomas Mejer Hansen,2017,https://link.springer.com/article/10.1007/s10596-017-9621-8,Article
A least squares approach for efficient and reliable short-term versus long-term optimization,Computational Geosciences,,,,10.1007/s10596-017-9620-9,Lasse Hjuler ChristiansenAndrea CapoleiJohn Bagterp Jørgensen,2017,https://link.springer.com/article/10.1007/s10596-017-9620-9,Article
Acknowledgement to reviewers,Computational Geosciences,,,,10.1007/s10596-017-9618-3,,2017,https://link.springer.com/article/10.1007/s10596-017-9618-3,Article
Nearly perfectly matched layer boundary conditions for operator upscaling of the acoustic wave equation,Computational Geosciences,,,,10.1007/s10596-017-9616-5,Chen LaiSusan E. Minkoff,2017,https://link.springer.com/article/10.1007/s10596-017-9616-5,Article
Process-based forward numerical ecological modeling for carbonate sedimentary basins,Computational Geosciences,,,,10.1007/s10596-017-9617-4,Roger Clavera-GispertÒscar GratacósAna CarmonaRaimon Tolosana-Delgado,2017,https://link.springer.com/article/10.1007/s10596-017-9617-4,Article
Dimensionality reduction for production optimization using polynomial approximations,Computational Geosciences,,,,10.1007/s10596-016-9610-3,Nadav SorekEduardo GildinFani BoukouvalaBurcu BeykalChristodoulos A. Floudas,2017,https://link.springer.com/article/10.1007/s10596-016-9610-3,Article
A low-dimensional subsurface model for saturated and unsaturated flow processes: ability to address heterogeneity,Computational Geosciences,,,,10.1007/s10596-017-9613-8,Sylvain WeillFrederick DelayYi PanPhilippe Ackerer,2017,https://link.springer.com/article/10.1007/s10596-017-9613-8,Article
Direct forecasting of reservoir performance using production data without history matching,Computational Geosciences,,,,10.1007/s10596-017-9614-7,Addy SatijaCeline ScheidtLewis LiJef Caers,2017,https://link.springer.com/article/10.1007/s10596-017-9614-7,Article
A multi-domain decomposition-based Fourier finite element method for the simulation of 3D marine CSEM measurements,Computational Geosciences,,,,10.1007/s10596-017-9615-6,Shaaban A. BakrDavid Pardo,2017,https://link.springer.com/article/10.1007/s10596-017-9615-6,Article
Gaussian Processes for history-matching: application to an unconventional gas reservoir,Computational Geosciences,,,,10.1007/s10596-016-9611-2,Hamidreza HamdiIvo CouckuytMario Costa SousaTom Dhaene,2017,https://link.springer.com/article/10.1007/s10596-016-9611-2,Article
Evaluation concepts to compare observed and simulated deposition areas of mass movements,Computational Geosciences,,,,10.1007/s10596-016-9609-9,M. HeiserC. ScheidlR. Kaitna,2017,https://link.springer.com/article/10.1007/s10596-016-9609-9,Article
Exploiting transformation-domain sparsity for fast query in multiple-point geostatistics,Computational Geosciences,,,,10.1007/s10596-016-9612-1,Mohammad J. AbdollahifardBehrooz Nasiri,2017,https://link.springer.com/article/10.1007/s10596-016-9612-1,Article
Probability distribution method based on the triple porosity model to identify the fluid properties of the volcanic reservoir in the Wangfu fault depression by well log,Computational Geosciences,,,,10.1007/s10596-016-9608-x,Lihua ZhangBaozhi PanGangyi ShanSihui LiuYuhang GuoChunhui Fang,2016,https://link.springer.com/article/10.1007/s10596-016-9608-x,Article
A model for CO<sub>2</sub> storage and seismic monitoring combining multiphase fluid flow and wave propagation simulators. The Sleipner-field case,Computational Geosciences,,,,10.1007/s10596-016-9607-y,Gabriela B. SavioliJuan E. SantosJosé M. CarcioneDavide Gei,2016,https://link.springer.com/article/10.1007/s10596-016-9607-y,Article
Parallel vertex approximate gradient discretization of hybrid dimensional Darcy flow and transport in discrete fracture networks,Computational Geosciences,,,,10.1007/s10596-016-9606-z,Feng XingRoland MassonSimon Lopez,2016,https://link.springer.com/article/10.1007/s10596-016-9606-z,Article
Comparison of linear solvers for equilibrium geochemistry computations,Computational Geosciences,,,,10.1007/s10596-016-9600-5,Hela MachatJérôme Carrayrou,2016,https://link.springer.com/article/10.1007/s10596-016-9600-5,Article
History matching of multi-facies channelized reservoirs using ES-MDA with common basis DCT,Computational Geosciences,,,,10.1007/s10596-016-9604-1,Yu ZhaoFahim ForouzanfarAlbert C. Reynolds,2016,https://link.springer.com/article/10.1007/s10596-016-9604-1,Article
Uncertainty quantification of two-phase flow problems via measure theory and the generalized multiscale finite element method,Computational Geosciences,,,,10.1007/s10596-016-9603-2,M. PreshoS. MattisC. Dawson,2016,https://link.springer.com/article/10.1007/s10596-016-9603-2,Article
Estimating observation error covariance matrix of seismic data from a perspective of image denoising,Computational Geosciences,,,,10.1007/s10596-016-9605-0,Xiaodong LuoTuhin Bhakta,2016,https://link.springer.com/article/10.1007/s10596-016-9605-0,Article
A unified formulation for generalized oilfield development optimization,Computational Geosciences,,,,10.1007/s10596-016-9594-z,Shiva NavabiReza KhaninezhadBehnam Jafarpour,2016,https://link.springer.com/article/10.1007/s10596-016-9594-z,Article
Evaluation of complex petroleum reservoirs based on data mining methods,Computational Geosciences,,,,10.1007/s10596-016-9601-4,Fengqi TanGang LuoDuojun WangYangkang Chen,2016,https://link.springer.com/article/10.1007/s10596-016-9601-4,Article
Coarse-scale data assimilation as a generic alternative to localization,Computational Geosciences,,,,10.1007/s10596-016-9602-3,Kristian FossumTrond Mannseth,2016,https://link.springer.com/article/10.1007/s10596-016-9602-3,Article
Probabilistic domain decomposition for the solution of the two-dimensional magnetotelluric problem,Computational Geosciences,,,,10.1007/s10596-016-9598-8,Alexander BihloColin G. FarquharsonRonald D. HaynesJ Concepción Loredo-Osti,2016,https://link.springer.com/article/10.1007/s10596-016-9598-8,Article
Localization and regularization for iterative ensemble smoothers,Computational Geosciences,,,,10.1007/s10596-016-9599-7,Yan ChenDean S. Oliver,2016,https://link.springer.com/article/10.1007/s10596-016-9599-7,Article
Efficient water table evolution discretization using domain transformation,Computational Geosciences,,,,10.1007/s10596-016-9597-9,W. M. BoonN. BalbariniP. J. BinningJ. M. Nordbotten,2016,https://link.springer.com/article/10.1007/s10596-016-9597-9,Article
Acceleration strategies for elastic full waveform inversion workflows in 2D and 3D,Computational Geosciences,,,,10.1007/s10596-016-9593-0,Jean KormannJuan E. RodríguezMiguel FerrerAlbert FarrésNatalia GutiérrezJosep de la PuenteMauricio HanzichJosé M. Cela,2016,https://link.springer.com/article/10.1007/s10596-016-9593-0,Article
A reactive transport simulator for variable porosity problems,Computational Geosciences,,,,10.1007/s10596-016-9596-x,Fabien GeorgetJean H. PrévostBruno Huet,2016,https://link.springer.com/article/10.1007/s10596-016-9596-x,Article
Joint hydrogeophysical inversion: state estimation for seawater intrusion models in 3D,Computational Geosciences,,,,10.1007/s10596-016-9595-y,Klara SteklovaEldad Haber,2016,https://link.springer.com/article/10.1007/s10596-016-9595-y,Article
A stochastic inversion workflow for monitoring the distribution of CO<sub>2</sub> injected into deep saline aquifers,Computational Geosciences,,,,10.1007/s10596-016-9590-3,Lorenzo PerozziErwan GloaguenBernard GirouxKlaus Holliger,2016,https://link.springer.com/article/10.1007/s10596-016-9590-3,Article
Multi-fidelity meta-modeling for reservoir engineering - application to history matching,Computational Geosciences,,,,10.1007/s10596-016-9587-y,Arthur ThenonVéronique GervaisMickaële Le Ravalec,2016,https://link.springer.com/article/10.1007/s10596-016-9587-y,Article
A quadrature-free method for simulation and inversion of 1.5D direct current (DC) borehole measurements,Computational Geosciences,,,,10.1007/s10596-016-9592-1,Sergio RojasIgnacio MugaDavid Pardo,2016,https://link.springer.com/article/10.1007/s10596-016-9592-1,Article
"Post-injection trapping of mobile CO<sub>
                <b>2</b>
              </sub> in deep aquifers: Assessing the importance of model and parameter uncertainties",Computational Geosciences,,,,10.1007/s10596-016-9588-x,JC. ManceauJ. Rohmer,2016,https://link.springer.com/article/10.1007/s10596-016-9588-x,Article
"Shallow-water simulations by a well-balanced WAF finite volume method: a case study to the great flood in 2011, Thailand",Computational Geosciences,,,,10.1007/s10596-016-9589-9,Thida PongsanguansinMontri MaleewongKhamron Mekchay,2016,https://link.springer.com/article/10.1007/s10596-016-9589-9,Article
Bayesian estimation of reservoir properties—effects of uncertainty quantification of 4D seismic data,Computational Geosciences,,,,10.1007/s10596-016-9585-0,Kjersti Solberg EikremGeir NævdalMorten JakobsenYan Chen,2016,https://link.springer.com/article/10.1007/s10596-016-9585-0,Article
A semi-implicit method for incompressible three-phase flow in porous media,Computational Geosciences,,,,10.1007/s10596-016-9583-2,Justin DongBéatrice Rivière,2016,https://link.springer.com/article/10.1007/s10596-016-9583-2,Article
"Pore-scale modelling techniques: balancing efficiency, performance, and robustness",Computational Geosciences,,,,10.1007/s10596-016-9586-z,Vahid Joekar-Niasar,2016,https://link.springer.com/article/10.1007/s10596-016-9586-z,Article
Well placement optimization subject to realistic field development constraints,Computational Geosciences,,,,10.1007/s10596-016-9584-1,Mansoureh JesmaniMathias C. BelloutRemus HaneaBjarne Foss,2016,https://link.springer.com/article/10.1007/s10596-016-9584-1,Article
X-ray computed microtomography—a useful tool for petrophysical properties determination,Computational Geosciences,,,,10.1007/s10596-016-9582-3,Jadwiga A. JarzynaPaulina I. KrakowskaEdyta PuskarczykKamila Wawrzyniak-GuzJakub BieleckiKonrad TkoczJacek TarasiukSebastian WrońskiMarek Dohnalik,2016,https://link.springer.com/article/10.1007/s10596-016-9582-3,Article
Convergence of iterative coupling of geomechanics with flow in a fractured poroelastic medium,Computational Geosciences,,,,10.1007/s10596-016-9573-4,Vivette GiraultKundan KumarMary F. Wheeler,2016,https://link.springer.com/article/10.1007/s10596-016-9573-4,Article
Numerical evaluation of mean-field homogenisation methods for predicting shale elastic response,Computational Geosciences,,,,10.1007/s10596-016-9579-y,M. GoodarziM. RouainiaA. C. Aplin,2016,https://link.springer.com/article/10.1007/s10596-016-9579-y,Article
Quantifying initial and wind forcing uncertainties in the Gulf of Mexico,Computational Geosciences,,,,10.1007/s10596-016-9581-4,Guotu LiMohamed IskandaraniMatthieu Le HénaffJustin WinokurOlivier P. Le MaîtreOmar M. Knio,2016,https://link.springer.com/article/10.1007/s10596-016-9581-4,Article
OpenMP and CUDA simulations of Sella Zerbino Dam break on unstructured grids,Computational Geosciences,,,,10.1007/s10596-016-9580-5,G. PetacciaF. LeporatiE. Torti,2016,https://link.springer.com/article/10.1007/s10596-016-9580-5,Article
Determination of lower and upper bounds of predicted production from history-matched models,Computational Geosciences,,,,10.1007/s10596-016-9576-1,G. M. van EssenS. KahrobaeiH. van OeverenP. M. J. Van den HofJ. D. Jansen,2016,https://link.springer.com/article/10.1007/s10596-016-9576-1,Article
Oxidation wave structure and oxygen breakthrough for air injection into light oil reservoirs,Computational Geosciences,,,,10.1007/s10596-016-9578-z,F. P. SantosA. A. MailybaevD. Marchesin,2016,https://link.springer.com/article/10.1007/s10596-016-9578-z,Article
Quantifying the uncertainty in the spatial layout of rock type domains in an iron ore deposit,Computational Geosciences,,,,10.1007/s10596-016-9574-3,Mohammad MalekiXavier EmeryAlejandro CáceresDiniz RibeiroEvandro Cunha,2016,https://link.springer.com/article/10.1007/s10596-016-9574-3,Article
Prediction of porosity and water saturation using pre-stack seismic attributes: a comparison of Bayesian inversion and computational intelligence methods,Computational Geosciences,,,,10.1007/s10596-016-9577-0,Hadi FattahiSadegh Karimpouli,2016,https://link.springer.com/article/10.1007/s10596-016-9577-0,Article
A new methodology for computing ionic profiles and disjoining pressure in swelling porous media,Computational Geosciences,,,,10.1007/s10596-016-9572-5,Aline C. RochaMarcio A. MuradChristian MoyneSaulo P. OliveiraTien D. Le,2016,https://link.springer.com/article/10.1007/s10596-016-9572-5,Article
Interpretation of well-cell pressures on hexagonal grids in numerical reservoir simulation,Computational Geosciences,,,,10.1007/s10596-016-9575-2,Ivar Aavatsmark,2016,https://link.springer.com/article/10.1007/s10596-016-9575-2,Article
Multiscale model reduction for shale gas transport in fractured media,Computational Geosciences,,,,10.1007/s10596-016-9571-6,I. Y. AkkutluYalchin EfendievMaria Vasilyeva,2016,https://link.springer.com/article/10.1007/s10596-016-9571-6,Article
A phase-field method for the direct simulation of two-phase flows in pore-scale media using a non-equilibrium wetting boundary condition,Computational Geosciences,,,,10.1007/s10596-015-9551-2,Faruk O. AlpakBeatrice RiviereFlorian Frank,2016,https://link.springer.com/article/10.1007/s10596-015-9551-2,Article
Fast linearized forecasts for subsurface flow data assimilation with ensemble Kalman filter,Computational Geosciences,,,,10.1007/s10596-016-9570-7,Mohammadali TarrahiSiavash Hakim ElahiBehnam Jafarpour,2016,https://link.springer.com/article/10.1007/s10596-016-9570-7,Article
Ordering-based nonlinear solver for fully-implicit simulation of three-phase flow,Computational Geosciences,,,,10.1007/s10596-015-9505-8,François P. HamonHamdi A. Tchelepi,2016,https://link.springer.com/article/10.1007/s10596-015-9505-8,Article
Selected contributions from the 14th European Conference on the Mathematics of Oil Recovery (ECMOR XIV),Computational Geosciences,,,,10.1007/s10596-016-9568-1,Alberto Cominelli,2016,https://link.springer.com/article/10.1007/s10596-016-9568-1,Article
Ordering-based nonlinear solver for fully-implicit simulation of three-phase flow,Computational Geosciences,,,,10.1007/s10596-016-9569-0,François P. HamonHamdi A. Tchelepi,2016,https://link.springer.com/article/10.1007/s10596-016-9569-0,Article
An evolutionary system for exploitation of fractured geothermal reservoirs,Computational Geosciences,,,,10.1007/s10596-015-9552-1,Mauro CastelliAlessio Fumagalli,2016,https://link.springer.com/article/10.1007/s10596-015-9552-1,Article
Optimal experimental design for reservoir property estimates in geothermal exploration,Computational Geosciences,,,,10.1007/s10596-016-9565-4,Ralf SeidlerKateryna PadalkinaH. Martin BückerAnozie EbigboMichael HertyGabriele MarquartJan Niederau,2016,https://link.springer.com/article/10.1007/s10596-016-9565-4,Article
Interpretation of well-cell pressures on stretched hexagonal grids in numerical reservoir simulation,Computational Geosciences,,,,10.1007/s10596-016-9567-2,Ivar Aavatsmark,2016,https://link.springer.com/article/10.1007/s10596-016-9567-2,Article
A multiobjective steepest descent method with applications to optimal well control,Computational Geosciences,,,,10.1007/s10596-016-9562-7,Xin LiuAlbert C. Reynolds,2016,https://link.springer.com/article/10.1007/s10596-016-9562-7,Article
A study on iterative methods for solving Richards’ equation,Computational Geosciences,,,,10.1007/s10596-016-9566-3,Florian ListFlorin A. Radu,2016,https://link.springer.com/article/10.1007/s10596-016-9566-3,Article
Model reduction and discretization using hybrid finite volumes for flow in porous media containing faults,Computational Geosciences,,,,10.1007/s10596-016-9558-3,Isabelle FailleAlessio FumagalliJérôme JaffréJean E. Roberts,2016,https://link.springer.com/article/10.1007/s10596-016-9558-3,Article
"An energy stable evolution method for simulating two-phase equilibria of multi-component fluids at constant moles, volume and temperature",Computational Geosciences,,,,10.1007/s10596-016-9564-5,Jisheng KouShuyu SunXiuhua Wang,2016,https://link.springer.com/article/10.1007/s10596-016-9564-5,Article
Uncertainty quantification in numerical simulation of particle-laden flows,Computational Geosciences,,,,10.1007/s10596-016-9563-6,Gabriel M. GuerraSouleymane ZioJose J. CamataJonas DiasRenato N. EliasMarta MattosoPaulo L. B. ParaizoAlvaro L. G. A. CoutinhoFernando A. Rochinha,2016,https://link.springer.com/article/10.1007/s10596-016-9563-6,Article
Generalized field-development optimization with well-control zonation,Computational Geosciences,,,,10.1007/s10596-016-9559-2,Abeeb A. Awotunde,2016,https://link.springer.com/article/10.1007/s10596-016-9559-2,Article
Finite-difference strategy for elastic wave modelling on curved staggered grids,Computational Geosciences,,,,10.1007/s10596-016-9561-8,C. A. Pérez SolanoD. DonnoH. Chauris,2016,https://link.springer.com/article/10.1007/s10596-016-9561-8,Article
Quantifying fracture geometry with X-ray tomography: Technique of Iterative Local Thresholding (TILT) for 3D image segmentation,Computational Geosciences,,,,10.1007/s10596-016-9560-9,Hang DengJeffrey P. FittsCatherine A. Peters,2016,https://link.springer.com/article/10.1007/s10596-016-9560-9,Article
Discrete fracture model for coupled flow and geomechanics,Computational Geosciences,,,,10.1007/s10596-015-9554-z,T. T. GaripovM. Karimi-FardH. A. Tchelepi,2016,https://link.springer.com/article/10.1007/s10596-015-9554-z,Article
The temperature-based localization for the application of EnKF on automatic history matching of the SAGD process,Computational Geosciences,,,,10.1007/s10596-016-9557-4,Yingchao HuangFanhua Zeng,2016,https://link.springer.com/article/10.1007/s10596-016-9557-4,Article
On a universal structure for immiscible three-phase flow in virgin reservoirs,Computational Geosciences,,,,10.1007/s10596-016-9556-5,Pablo CastañedaEduardo AbreuFrederico FurtadoDan Marchesin,2016,https://link.springer.com/article/10.1007/s10596-016-9556-5,Article
On nonequilibrium models of spontaneous countercurrent imbibition,Computational Geosciences,,,,10.1007/s10596-015-9555-y,Prosper K. TorsuSaman A. Aryana,2016,https://link.springer.com/article/10.1007/s10596-015-9555-y,Article
Reduction of computing time for least-squares migration based on the Helmholtz equation by graphics processing units,Computational Geosciences,,,,10.1007/s10596-015-9546-z,H. KnibbeC. VuikC. W. Oosterlee,2015,https://link.springer.com/article/10.1007/s10596-015-9546-z,Article
Multiphase lattice Boltzmann simulations for porous media applications,Computational Geosciences,,,,10.1007/s10596-015-9542-3,Haihu LiuQinjun KangChristopher R. LeonardiSebastian SchmieschekAriel NarváezBruce D. JonesJohn R. WilliamsAlbert J. ValocchiJens Harting,2015,https://link.springer.com/article/10.1007/s10596-015-9542-3,Article
Complex geology estimation using the iterative adaptive Gaussian mixture filter,Computational Geosciences,,,,10.1007/s10596-015-9553-0,Bogdan SebacherAndreas StordalRemus Hanea,2015,https://link.springer.com/article/10.1007/s10596-015-9553-0,Article
Robust simulation of sharp-interface models for fast estimation of CO<sub>2</sub> trapping capacity in large-scale aquifer systems,Computational Geosciences,,,,10.1007/s10596-015-9549-9,Halvor Møll NilsenKnut-Andreas LieOdd Andersen,2015,https://link.springer.com/article/10.1007/s10596-015-9549-9,Article
A generalized cubic equation of state with application to pure CO<sub>2</sub> injection in aquifers,Computational Geosciences,,,,10.1007/s10596-015-9537-0,Ivar AavatsmarkBawfeh Kingsley KometaSarah E. GasdaTor Harald SandveHalvor Møll Nilsen,2015,https://link.springer.com/article/10.1007/s10596-015-9537-0,Article
Sensitivity of HF radar-derived surface current self-organizing maps to various processing procedures and mesoscale wind forcing,Computational Geosciences,,,,10.1007/s10596-015-9550-3,Ivica VilibićHrvoje KalinićHrvoje MihanovićSimone CosoliMartina TudorNedjeljka žagarBlaž Jesenko,2015,https://link.springer.com/article/10.1007/s10596-015-9550-3,Article
Regularization of geophysical ill-posed problems by iteratively re-weighted and refined least squares,Computational Geosciences,,,,10.1007/s10596-015-9544-1,Ali GholamiHamzeh Mohammadi Gheymasi,2015,https://link.springer.com/article/10.1007/s10596-015-9544-1,Article
Beyond dual-porosity modeling for the simulation of complex flow mechanisms in shale reservoirs,Computational Geosciences,,,,10.1007/s10596-015-9548-x,Bicheng YanYuhe WangJohn E. Killough,2015,https://link.springer.com/article/10.1007/s10596-015-9548-x,Article
Fully-implicit simulation of vertical-equilibrium models with hysteresis and capillary fringe,Computational Geosciences,,,,10.1007/s10596-015-9547-y,Halvor Møll NilsenKnut-Andreas LieOdd Andersen,2015,https://link.springer.com/article/10.1007/s10596-015-9547-y,Article
An embedded fracture modeling framework for simulation of hydraulic fracturing and shear stimulation,Computational Geosciences,,,,10.1007/s10596-015-9543-2,Jack H. NorbeckMark W. McClureJonathan W. LoRoland N. Horne,2015,https://link.springer.com/article/10.1007/s10596-015-9543-2,Article
Towards a hierarchical parametrization to address prior uncertainty in ensemble-based data assimilation,Computational Geosciences,,,,10.1007/s10596-015-9545-0,Alexandre Anozé Emerick,2015,https://link.springer.com/article/10.1007/s10596-015-9545-0,Article
Phase-field modeling of a fluid-driven fracture in a poroelastic medium,Computational Geosciences,,,,10.1007/s10596-015-9532-5,A. MikelićM. F. WheelerT. Wick,2015,https://link.springer.com/article/10.1007/s10596-015-9532-5,Article
Integration of Markov mesh models and data assimilation techniques in complex reservoirs,Computational Geosciences,,,,10.1007/s10596-015-9540-5,M. PanzeriE. L. Della RossaL. DoveraM. RivaA. Guadagnini,2015,https://link.springer.com/article/10.1007/s10596-015-9540-5,Article
